{
  "$schema": "urn:scholar-ppt-cn:project:1.0.0",
  "schema_version": "1.0.0",
  "project": {
    "id": "demo-project",
    "slug": "demo-project",
    "title": "示例学术汇报",
    "language": "zh-CN",
    "task_type": "create",
    "output_dir": "outputs/demo-project",
    "source_files": [
      "sources/demo-paper.pdf"
    ]
  },
  "canvas": {
    "source": "default",
    "width_inches": 13.3333,
    "height_inches": 7.5
  },
  "template": {
    "source": "neutral-tokens",
    "id": "neutral-dev",
    "path": null,
    "adherence": "guided",
    "dna": {
      "status": "selected",
      "colors": [
        "#16324F",
        "#F4F1EA",
        "#D36B3D"
      ],
      "font_roles": {
        "title": {
          "families": [
            "Microsoft YaHei",
            "PingFang SC",
            "Noto Sans CJK SC"
          ],
          "weight": 700
        },
        "body": {
          "families": [
            "Microsoft YaHei",
            "PingFang SC",
            "Noto Sans CJK SC"
          ],
          "weight": 400
        }
      },
      "notes": [
        "Development-only neutral design tokens."
      ]
    }
  },
  "capabilities": {
    "filesystem": {
      "available": true,
      "provider": "python-pathlib",
      "notes": "Available."
    },
    "pptx_write": {
      "available": null,
      "provider": null,
      "notes": "Host capability not yet probed."
    },
    "image_generation": {
      "available": false,
      "provider": null,
      "notes": "Not needed for this task."
    }
  },
  "workflow": {
    "steps": {
      "intake": {
        "status": "completed",
        "reason": "Source paper registered."
      },
      "project-state": {
        "status": "completed",
        "reason": "project.json created."
      },
      "evidence-index": {
        "status": "completed",
        "reason": "One evidence figure indexed."
      },
      "template-dna": {
        "status": "completed",
        "reason": "Neutral design tokens selected."
      },
      "planning": {
        "status": "completed",
        "reason": "Two-slide fixture planned."
      },
      "family-blueprint": {
        "status": "skipped",
        "reason": "The fixture is too small to need reusable visual families."
      },
      "visual-samples": {
        "status": "skipped",
        "reason": "Direct editable output requested."
      },
      "editable-pptx": {
        "status": "planned",
        "reason": "PPTX generation is outside this fixture."
      },
      "static-qa": {
        "status": "planned",
        "reason": "Run after a PPTX exists."
      },
      "render-preview": {
        "status": "planned",
        "reason": "Run when a renderer is available."
      },
      "visual-qa": {
        "status": "not-applicable",
        "reason": "No rendered deck exists yet."
      }
    }
  },
  "assets": [
    {
      "id": "asset-fig-1",
      "type": "figure",
      "path": "sources/fig-1.png",
      "source_ref": {
        "source_file": "sources/demo-paper.pdf",
        "page": 3,
        "figure": "Figure 1",
        "citation": "Demo et al. (2026)"
      },
      "geometry": "wide",
      "summary": "研究流程示意图",
      "used_on_slides": [
        "slide-2"
      ]
    }
  ],
  "slides": [
    {
      "id": "slide-1",
      "number": 1,
      "title": "示例学术汇报",
      "narrative_section": "封面",
      "communication_task": "建立主题与汇报语境",
      "core_message": "介绍本次汇报主题",
      "source_asset_ids": [],
      "layout": {
        "archetype_id": "O1",
        "family_id": null,
        "variant_id": null,
        "decision_reason": "使用低密度封面结构"
      },
      "density": "low",
      "asset_handling": "not-applicable",
      "risks": []
    },
    {
      "id": "slide-2",
      "number": 2,
      "title": "研究流程",
      "narrative_section": "方法",
      "communication_task": "解释研究步骤",
      "core_message": "研究由三个连续阶段组成",
      "source_asset_ids": [
        "asset-fig-1"
      ],
      "layout": {
        "archetype_id": "M1",
        "family_id": null,
        "variant_id": null,
        "decision_reason": "宽图适合横向流程页面"
      },
      "density": "medium",
      "asset_handling": "preserve",
      "risks": [
        "检查图中文字投影可读性"
      ]
    }
  ],
  "visual_system": {
    "families": [],
    "variants": [],
    "sample_slide_ids": []
  },
  "artifacts": {
    "planning_markdown": "outputs/demo-project/planning.md",
    "pptx": null,
    "preview_dir": null,
    "montage": null,
    "qa_report": "outputs/demo-project/qa-report.json",
    "qa_note": "outputs/demo-project/qa-note.md"
  },
  "qa": {
    "status": "not-run",
    "issues": [],
    "skipped_checks": []
  }
}
